{
  "entries": [
    {
      "atomic_bundle_bytes": 786432,
      "expert_id": 0,
      "layer": 1,
      "projections": {
        "down": {
          "expert_axis": 2,
          "expert_slice_bytes": 262144,
          "ggml_type": {
            "id": 1,
            "name": "f16"
          },
          "gguf_alignment": 32,
          "layout_kind": "contiguous",
          "logical_shape": [
            256,
            512,
            8,
            1
          ],
          "physical_strides": [
            2,
            512,
            262144,
            2097152
          ],
          "runtime": {
            "backend_transform": false,
            "buffer_type": "CPU",
            "layout_transform": false,
            "repack": false
          },
          "source_file_identity": "/usr/local/src/k3-out-of-core/models/gguf/Kimi-K3-0.40B-F16.gguf",
          "source_file_index": 0,
          "source_file_size": 784318432,
          "spans": [
            {
              "file_offset": 695440352,
              "length": 262144,
              "logical_offset": 0
            }
          ],
          "tensor_base_offset": 695440352,
          "tensor_byte_size": 2097152,
          "tensor_name": "blk.1.ffn_down_exps.weight"
        },
        "gate": {
          "expert_axis": 2,
          "expert_slice_bytes": 262144,
          "ggml_type": {
            "id": 1,
            "name": "f16"
          },
          "gguf_alignment": 32,
          "layout_kind": "contiguous",
          "logical_shape": [
            512,
            256,
            8,
            1
          ],
          "physical_strides": [
            2,
            1024,
            262144,
            2097152
          ],
          "runtime": {
            "backend_transform": false,
            "buffer_type": "CPU",
            "layout_transform": false,
            "repack": false
          },
          "source_file_identity": "/usr/local/src/k3-out-of-core/models/gguf/Kimi-K3-0.40B-F16.gguf",
          "source_file_index": 0,
          "source_file_size": 784318432,
          "spans": [
            {
              "file_offset": 693343200,
              "length": 262144,
              "logical_offset": 0
            }
          ],
          "tensor_base_offset": 693343200,
          "tensor_byte_size": 2097152,
          "tensor_name": "blk.1.ffn_gate_exps.weight"
        },
        "up": {
          "expert_axis": 2,
          "expert_slice_bytes": 262144,
          "ggml_type": {
            "id": 1,
            "name": "f16"
          },
          "gguf_alignment": 32,
          "layout_kind": "contiguous",
          "logical_shape": [
            512,
            256,
            8,
            1
          ],
          "physical_strides": [
            2,
            1024,
            262144,
            2097152
          ],
          "runtime": {
            "backend_transform": false,
            "buffer_type": "CPU",
            "layout_transform": false,
            "repack": false
          },
          "source_file_identity": "/usr/local/src/k3-out-of-core/models/gguf/Kimi-K3-0.40B-F16.gguf",
          "source_file_index": 0,
          "source_file_size": 784318432,
          "spans": [
            {
              "file_offset": 697537504,
              "length": 262144,
              "logical_offset": 0
            }
          ],
          "tensor_base_offset": 697537504,
          "tensor_byte_size": 2097152,
          "tensor_name": "blk.1.ffn_up_exps.weight"
        }
      }
    },
    {
      "atomic_bundle_bytes": 786432,
      "expert_id": 1,
      "layer": 1,
      "projections": {
        "down": {
          "expert_axis": 2,
          "expert_slice_bytes": 262144,
          "ggml_type": {
            "id": 1,
            "name": "f16"
          },
          "gguf_alignment": 32,
          "layout_kind": "contiguous",
          "logical_shape": [
            256,
            512,
            8,
            1
          ],
          "physical_strides": [
            2,
            512,
            262144,
            2097152
          ],
          "runtime": {
            "backend_transform": false,
            "buffer_type": "CPU",
            "layout_transform": false,
            "repack": false
          },
          "source_file_identity": "/usr/local/src/k3-out-of-core/models/gguf/Kimi-K3-0.40B-F16.gguf",
          "source_file_index": 0,
          "source_file_size": 784318432,
          "spans": [
            {
              "file_offset": 695702496,
              "length": 262144,
              "logical_offset": 0
            }
          ],
          "tensor_base_offset": 695440352,
          "tensor_byte_size": 2097152,
          "tensor_name": "blk.1.ffn_down_exps.weight"
        },
        "gate": {
          "expert_axis": 2,
          "expert_slice_bytes": 262144,
          "ggml_type": {
            "id": 1,
            "name": "f16"
          },
          "gguf_alignment": 32,
          "layout_kind": "contiguous",
          "logical_shape": [
            512,
            256,
            8,
            1
          ],
          "physical_strides": [
            2,
            1024,
            262144,
            2097152
          ],
          "runtime": {
            "backend_transform": false,
            "buffer_type": "CPU",
            "layout_transform": false,
            "repack": false
          },
          "source_file_identity": "/usr/local/src/k3-out-of-core/models/gguf/Kimi-K3-0.40B-F16.gguf",
          "source_file_index": 0,
          "source_file_size": 784318432,
          "spans": [
            {
              "file_offset": 693605344,
              "length": 262144,
              "logical_offset": 0
            }
          ],
          "tensor_base_offset": 693343200,
          "tensor_byte_size": 2097152,
          "tensor_name": "blk.1.ffn_gate_exps.weight"
        },
        "up": {
          "expert_axis": 2,
          "expert_slice_bytes": 262144,
          "ggml_type": {
            "id": 1,
            "name": "f16"
          },
          "gguf_alignment": 32,
          "layout_kind": "contiguous",
          "logical_shape": [
            512,
            256,
            8,
            1
          ],
          "physical_strides": [
            2,
            1024,
            262144,
            2097152
          ],
          "runtime": {
            "backend_transform": false,
            "buffer_type": "CPU",
            "layout_transform": false,
            "repack": false
          },
          "source_file_identity": "/usr/local/src/k3-out-of-core/models/gguf/Kimi-K3-0.40B-F16.gguf",
          "source_file_index": 0,
          "source_file_size": 784318432,
          "spans": [
            {
              "file_offset": 697799648,
              "length": 262144,
              "logical_offset": 0
            }
          ],
          "tensor_base_offset": 697537504,
          "tensor_byte_size": 2097152,
          "tensor_name": "blk.1.ffn_up_exps.weight"
        }
      }
    },
    {
      "atomic_bundle_bytes": 786432,
      "expert_id": 2,
      "layer": 1,
      "projections": {
        "down": {
          "expert_axis": 2,
          "expert_slice_bytes": 262144,
          "ggml_type": {
            "id": 1,
            "name": "f16"
          },
          "gguf_alignment": 32,
          "layout_kind": "contiguous",
          "logical_shape": [
            256,
            512,
            8,
            1
          ],
          "physical_strides": [
            2,
            512,
            262144,
            2097152
          ],
          "runtime": {
            "backend_transform": false,
            "buffer_type": "CPU",
            "layout_transform": false,
            "repack": false
          },
          "source_file_identity": "/usr/local/src/k3-out-of-core/models/gguf/Kimi-K3-0.40B-F16.gguf",
          "source_file_index": 0,
          "source_file_size": 784318432,
          "spans": [
            {
              "file_offset": 695964640,
              "length": 262144,
              "logical_offset": 0
            }
          ],
          "tensor_base_offset": 695440352,
          "tensor_byte_size": 2097152,
          "tensor_name": "blk.1.ffn_down_exps.weight"
        },
        "gate": {
          "expert_axis": 2,
          "expert_slice_bytes": 262144,
          "ggml_type": {
            "id": 1,
            "name": "f16"
          },
          "gguf_alignment": 32,
          "layout_kind": "contiguous",
          "logical_shape": [
            512,
            256,
            8,
            1
          ],
          "physical_strides": [
            2,
            1024,
            262144,
            2097152
          ],
          "runtime": {
            "backend_transform": false,
            "buffer_type": "CPU",
            "layout_transform": false,
            "repack": false
          },
          "source_file_identity": "/usr/local/src/k3-out-of-core/models/gguf/Kimi-K3-0.40B-F16.gguf",
          "source_file_index": 0,
          "source_file_size": 784318432,
          "spans": [
            {
              "file_offset": 693867488,
              "length": 262144,
              "logical_offset": 0
            }
          ],
          "tensor_base_offset": 693343200,
          "tensor_byte_size": 2097152,
          "tensor_name": "blk.1.ffn_gate_exps.weight"
        },
        "up": {
          "expert_axis": 2,
          "expert_slice_bytes": 262144,
          "ggml_type": {
            "id": 1,
            "name": "f16"
          },
          "gguf_alignment": 32,
          "layout_kind": "contiguous",
          "logical_shape": [
            512,
            256,
            8,
            1
          ],
          "physical_strides": [
            2,
            1024,
            262144,
            2097152
          ],
          "runtime": {
            "backend_transform": false,
            "buffer_type": "CPU",